{
  "approval_id": "approval-code-c-linux-worker-build-py31315",
  "approval_scope": "PYTHON_ARTIFACT_INVENTORY_PROVENANCE",
  "authority_policy_sha256": "e4f8eb4eb82e9ae5a12764b5f950211e2ef18b8727647e65108efd452ea4aa12",
  "authority_policy_version": "1",
  "canonicalization_version": "json-utf8-lf-v1",
  "created_at": "2026-09-01T12:05:00Z",
  "decision": "APPROVED",
  "decision_reason": "Code F approves the frozen exact provenance subject after independent schema, graph, resolver, target, and byte-integrity review; this is not license, vulnerability, native, or distribution approval.",
  "expires_at": null,
  "recheck_triggers": [
    "SUBJECT_BYTES_CHANGED",
    "TARGET_DESCRIPTOR_CHANGED",
    "REVIEW_EVIDENCE_CHANGED",
    "APPROVAL_POLICY_CHANGED",
    "AUTHORITY_POLICY_CHANGED",
    "SCHEMA_CHANGED"
  ],
  "review_evidence_snapshot_id": "review-snapshot-code-c-python-inventory-v3-v2-20260901",
  "review_evidence_snapshot_sha256": "198a199992e5e5895569f063102886196ba094c8143bdfc824ef94ea4967ae78",
  "reviewer": "Code F",
  "reviewer_authority": "CODE_F_QUALITY_RELEASE_COMPLIANCE_OWNER",
  "reviewer_role": "Quality, Release & Compliance Continuous Owner",
  "schema_version": "2",
  "subject_id": "code-c-linux-worker-build-py31315",
  "subject_role": "WORKER_BUILD",
  "subject_schema_id": "https://local.app/schemas/compliance/python-artifact-inventory/v3/inventory.schema.json",
  "subject_schema_sha256": "7a4999d4e31c83f3691ad69be6dc49822c4d0eebd77330964401ae349ae64e0e",
  "subject_schema_version": "3",
  "subject_sha256": "de1538e8753bbee056f238f6483d3f9d080eb018ec74b5f5926a58a078fcf56c",
  "subject_type": "PYTHON_ARTIFACT_INVENTORY",
  "supersedes": null,
  "target_descriptor_id": "code-c-linux-cpython-31315-x86-64-2b71b8be5739",
  "target_descriptor_sha256": "2b71b8be5739e2ef139ac4e6d3e15a6bdd7dd1805484ce227dbfcf094a36da67"
}
